{
  "publication_contract_version": "1.1",
  "pointer_version": "1.0",
  "analysis_id": "3c07b5c0e7a3ed0c8aabcce577be51f4906abff8755f2e1f16305b55a043dbdb",
  "generation_id": "6c2260ba8b98d8fccd20d14e35fb616ff40e1d7bc1d7af296cf514e962deffa0",
  "run_id": "3c07b5c0e7a3ed0c8aabcce577be51f4906abff8755f2e1f16305b55a043dbdb",
  "data_date": "2026-07-31",
  "generation": "generations/6c2260ba8b98d8fccd20d14e35fb616ff40e1d7bc1d7af296cf514e962deffa0",
  "previous_generation_id": "6df6bad82c5e2d0b0cd0c7cf14d597f10416fff5cc750893dd1f3a08413a4848",
  "manifest_sha256": "8026913c716dab0b5ff5b85402d4d8e7c903055d7b4266496763dd24ef071854"
}
